{
  "package_status": "teaching_reconstruction",
  "baseline_release": "PGF 1.0.0",
  "case_id": "ADP-CS-TRAIN-01",
  "source_case": "DPIA-CS-TRAIN-01 / Example 2.1-R",
  "original_decision_date": "2026-03-25",
  "ledger_snapshot_date": "2026-10-26",
  "measurements_status": "illustrative source assumptions; no attack experiments reproduced",
  "privacy_unit": "one customer including records",
  "adjacency": "add/remove one customer",
  "metrics": {
    "accuracy": 0.53,
    "auc": 0.55,
    "dcr_p5": 0.21,
    "nndr_median": 0.81
  },
  "metric_weights": [
    0.25,
    0.25,
    0.25,
    0.25
  ],
  "expected": {
    "indicator": 0.5369047619047619,
    "s1_likelihood": "Medium",
    "severity_index": 7,
    "severity": "Significant",
    "track_a_residual": "Medium",
    "track_a_inherent": "Medium",
    "track_b_index": 3,
    "track_b_level": "Moderate"
  },
  "ledger": {
    "epsilon_entries": [
      2.1,
      1.8,
      2.6
    ],
    "delta_entries": [
      "0.000008",
      "0.000000001",
      "0.000000001"
    ],
    "epsilon_lifetime_cap": "10",
    "delta_lifetime_cap": "0.00001",
    "annual_2026_epsilon_cap": "7",
    "expected_epsilon": "6.5",
    "expected_delta": "0.000008002",
    "expected_delta_utilisation_percent": "80.02",
    "new_charge_from_reconstruction": "0"
  },
  "hypothetical_change": {
    "status": "proposed_not_executed",
    "epsilon": "0.4",
    "delta": "0.000003",
    "expected_total_epsilon": "6.9",
    "expected_total_delta": "0.000011002",
    "expected_delta_excess": "0.000001002",
    "budget_preflight": "FAIL",
    "new_charge": "0",
    "also_violates_current_project_delta_configuration": true,
    "calculation_status": "INCOMPLETE"
  },
  "evidence_ids": [
    "ADP-01",
    "ADP-02",
    "ADP-03",
    "ADP-04",
    "ADP-05",
    "ADP-06",
    "ADP-07",
    "ADP-08"
  ],
  "companion_version": "0.2.0-preview.1",
  "preview_date": "2026-10-29",
  "metric_observations": [
    {
      "name": "MIA accuracy",
      "upper": "0.54",
      "threshold": "0.60",
      "comparison": "<",
      "role": "weighted",
      "criterion_result": "PASS"
    },
    {
      "name": "MIA AUC",
      "upper": "0.56",
      "threshold": "0.60",
      "comparison": "<",
      "role": "weighted",
      "criterion_result": "PASS"
    },
    {
      "name": "TPR at FPR 0.1%",
      "upper": "0.0037",
      "threshold": "0.01",
      "comparison": "<=",
      "role": "review_only",
      "criterion_result": "PASS"
    },
    {
      "name": "DCR P5",
      "lower": "0.20",
      "threshold": "0.15",
      "comparison": ">=",
      "role": "weighted",
      "criterion_result": "PASS"
    },
    {
      "name": "NNDR median",
      "lower": "0.80",
      "threshold": "0.70",
      "comparison": ">",
      "role": "weighted",
      "criterion_result": "PASS"
    },
    {
      "name": "linkability advantage",
      "upper": "0.025",
      "threshold": "0.05",
      "comparison": "<=",
      "role": "review_only",
      "criterion_result": "PASS"
    },
    {
      "name": "attribute-inference advantage",
      "upper": "0.035",
      "threshold": "0.05",
      "comparison": "<=",
      "role": "review_only",
      "criterion_result": "PASS"
    }
  ],
  "initial_design": {
    "source_example": "2.1",
    "metrics": {
      "accuracy": 0.54,
      "auc": 0.57,
      "dcr_p5": 0.19,
      "nndr_median": 0.78
    },
    "epsilon": "2.1",
    "delta": "0.000008",
    "expected_indicator": 0.6557017543859649,
    "expected_likelihood": "Medium",
    "expected_risk": "Medium",
    "decision": "REDESIGN",
    "configuration_difference": true,
    "observed_output_charged": true
  },
  "business_decision": {
    "purpose_and_benefit": "Calibrate the credit model without source-record access by Data Science.",
    "individual_risk": "Medium",
    "organisational_consequences": "Moderate; no offset against individual risk.",
    "alternatives": "First design, redesign, restricted access or no release; source records redesign.",
    "advice_and_response": "DPO conditions followed; no extra historical dissent invented.",
    "conditions_and_review": "Per-run epsilon <= 2.0; ledger caps; access boundary; next calibration or 25 March 2027.",
    "cost_limitations": "Monetary and operational cost amounts not supplied; no new cost-benefit evidence claimed."
  }
}
